Title,URL,Category,Summary,Justification
Texas governor seeks to remove Democratic leader from office,https://www.houstonpublicmedia.org/articles/news/politics/2025/08/05/527957/ag-ken-paxton-will-seek-court-order-to-have-dems-who-have-broken-quorum-thrown-out-of-office/,Politics ,"Texas Democratic lawmakers have fled the state to protest a proposed Republican redistricting plan, leading the Governor to threaten their removal from office. Justification: This political maneuver could lead to significant shifts in legislative power and policy direction, potentially impacting business regulations, taxation, and economic development in Texas.","This political maneuver could lead to significant shifts in legislative power and policy direction, potentially impacting business regulations, taxation, and economic development in Texas."
"CDC to disburse delayed funds for fighting fentanyl and more, staffers say",https://www.npr.org/sections/shots-health-news/2025/08/05/nx-s1-5493279/cdc-funding-freeze-overdose-omb,Public Health ,"The CDC is set to release previously frozen funds aimed at combating the fentanyl crisis and other health issues. Justification: The allocation of funds can lead to changes in public health strategies, potentially affecting healthcare costs, insurance markets, and the overall economic burden of substance abuse.","The allocation of funds can lead to changes in public health strategies, potentially affecting healthcare costs, insurance markets, and the overall economic burden of substance abuse."
4 European countries agree to buy a combined $1 billion in U.S. weapons for Ukraine,https://www.npr.org/2025/08/05/g-s1-81084/europe-us-weapons-ukraine-russia-war,Ukraine invasion — explained ,"Four European countries have agreed to purchase $1 billion in U.S. weapons for Ukraine amidst ongoing conflict. Justification: This deal could disrupt the global arms market, influence international relations, and impact defense spending and manufacturing within the involved countries.","This deal could disrupt the global arms market, influence international relations, and impact defense spending and manufacturing within the involved countries."
Drones delivering coffee? Trump administration wants more companies using UAVs,https://www.npr.org/2025/08/05/g-s1-81121/drones-uavs-trump-administration-faa-duffy,National ,"The Trump administration is encouraging more companies to use drones for commercial purposes such as delivering coffee. Justification: The expansion of drone usage for commercial deliveries could revolutionize logistics, impact employment in traditional delivery services, and create new regulatory challenges.","The expansion of drone usage for commercial deliveries could revolutionize logistics, impact employment in traditional delivery services, and create new regulatory challenges."
"State Department may require some visa applicants to post bond of up to $15,000",https://www.npr.org/2025/08/04/nx-s1-5492557/state-department-visa-applicants-bond,Politics ,"The State Department is considering a pilot program that would require visa applicants from certain countries to post a bond of up to $15,000. Justification: This policy could deter visitors and potential immigrants, affecting tourism, international education, labor markets, and diplomatic relations.","This policy could deter visitors and potential immigrants, affecting tourism, international education, labor markets, and diplomatic relations."
This Tuscan startup sold all its olive oil in the U.S. Then came Trump's tariffs,https://www.npr.org/2025/08/05/nx-s1-5464844/trump-tariffs-europe-olive-oil,Business ,"A Tuscan olive oil startup faces challenges after new U.S. tariffs disrupt its export plans, forcing it to seek markets elsewhere. Justification: Tariffs can significantly alter international trade dynamics, impacting small businesses and global supply chains, leading to potential price increases and market shifts.","Tariffs can significantly alter international trade dynamics, impacting small businesses and global supply chains, leading to potential price increases and market shifts."
"He said, she said, it said: I used ChatGPT as a couple's counselor. How did we fare?",https://www.npr.org/2025/08/05/nx-s1-5490447/ai-chatgpt-couples-therapy-advice,Technology ,"An individual tests AI chatbot ChatGPT as a couple's counselor, exploring its potential biases and effectiveness in communication. Justification: The adoption of AI in personal and therapeutic services could disrupt traditional counseling professions and raise ethical questions about machine involvement in personal matters.",The adoption of AI in personal and therapeutic services could disrupt traditional counseling professions and raise ethical questions about machine involvement in personal matters.
Wildfire smoke is like smoking 'half a pack a day.' Here's how to protect yourself,https://www.npr.org/2025/08/04/nx-s1-5492448/health-michigan-canada-smoke-minnesota-air-quality-wildfire,Climate ,"Wildfires in Canada are causing air quality issues across the U.S., likened to smoking half a pack of cigarettes a day. Justification: The increasing frequency and intensity of wildfires due to climate change can have profound health and economic impacts, affecting healthcare costs, labor productivity, and environmental policy.","The increasing frequency and intensity of wildfires due to climate change can have profound health and economic impacts, affecting healthcare costs, labor productivity, and environmental policy."
Why a NASA satellite that scientists and farmers rely on may be destroyed on purpose,https://www.npr.org/2025/08/04/nx-s1-5453731/nasa-carbon-dioxide-satellite-mission-threatened,Climate ,"NASA considers ending missions for satellites that measure carbon dioxide, potentially affecting climate research and agricultural planning. Justification: The loss of climate monitoring capabilities could disrupt scientific research, environmental policy-making, and agricultural industries that rely on accurate data for crop management.","The loss of climate monitoring capabilities could disrupt scientific research, environmental policy-making, and agricultural industries that rely on accurate data for crop management."
Scientists crack the case of the melting sea stars after decade-long hunt,https://www.kuow.org/stories/scientists-crack-the-case-of-the-melting-sea-stars-it-only-took-a-decade,No category found ,"Researchers have identified the pathogen responsible for a disease that decimated sea star populations, with implications for marine ecosystems. Justification: Understanding and addressing marine diseases can have significant implications for biodiversity, fisheries, and the broader ocean economy, which are critical for many coastal communities.","Understanding and addressing marine diseases can have significant implications for biodiversity, fisheries, and the broader ocean economy, which are critical for many coastal communities."
